{
  "decision_id": "DEC-2026-0002",
  "timestamp": "2026-06-18T17:00:00Z",
  "title": "Sponsor 平等讨论后调整: 业务项目 2 层合规 + 8 PMO 角色 + 3 层上报 + 3 维度考核 + 项目间消息",
  "category": "governance-change",
  "context": "Sponsor (你) 与 PMO 平等讨论后, 重新梳理业务项目结构 + PMO 角色 + 监管边界, 解决了 4 个关键点出: (1) 业务项目分业务组+研发组; (2) 业务组业务项目预设 8 agent, 后期调整; (3) 研发组 PMO 预先设置 agent, 后期业务项目可调但必须符合 PMO; (4) 业务项目整体+业务项目内研发都要符合 PMO (双层合规)。",
  "decision": "采用 14 块关键调整: (1) 业务项目 2 层合规 (业务项目整体 + 业务项目内研发 5 阶段); (2) 业务项目内业务自管 (业务 agent 按业务场景配置); (3) 5 阶段研发角色 (需求/研发/测试/运维/评估); (4) 3 层上报机制 (业务项目自采 + 业务项目上报 + PMO 存上报); (5) 8 PMO 角色 (按 3 维度严格分离); (6) 3 维度架构; (7) 3 维度分别考核; (8) 3 维度监控; (9) 项目间消息经 PMO 中介; (10) 0.0.7 解耦严格化; (11) 3 层异常拦截边界清晰化; (12) 业务 agent 不固定 8 个; (13) PMO 不提供业务场景模板; (14) 业务项目接入 PMO 5 步流程。",
  "rationale": "Sponsor 平等讨论后修订, 解决了之前 PMO 5 agent 不能严格按 3 维度采集数据的问题。不同维度 (业务项目整体 / 研发 5 阶段 / 业务项目内业务) 考核指标不同 + 数据源不同, PMO 角色必须严格按 3 维度分离 (PMO-Main 维度 1 / PMO-Engineer-Agent 维度 2 / PMO-Monitor-Agent 维度 3 上报)。业务项目自管业务内容 (PMO 不干预), PMO 监管业务项目按 PMO 规范上报关键指标 (PMO 存上报数据, 不存业务全量)。",
  "alternatives_considered": [
    "之前 5 PMO agent (1 角色采 3 维度数据, 混乱)",
    "8 PMO 角色按 3 维度严格分离 (本决策方案)",
    "PMO 完全不管业务, 业务项目 100% 自管 (放弃 PMO 监管)"
  ],
  "impact_analysis": {
    "scope": "PMO 治理层 + agent 设计 + 业务接入路径 + 业务项目流程",
    "affected_projects": ["1.1-pmo-self", "1.2-biz", "1.3-biz", "1.4-biz"],
    "risk": "medium"
  },
  "actor": "L0 Sponsor (平等讨论推动)",
  "sponsor_approved": true,
  "approval_timestamp": "2026-06-18T17:00:00Z",
  "implementation": {
    "files_affected": [
      "immutable/0-governance/0.0.10-1spec-Nprojects.md",
      "config/pmo.config.yaml",
      ".cursor/plans/ai_pmo_与业务系统架构方案_b58603d7.plan.md",
      "decisions/active/DEC-2026-0002.json",
      "docs/3-dimension-architecture.md",
      "docs/project-inter-messaging.md",
      "docs/biz-project-onboarding-5-steps.md",
      "biz-projects/templates/contract-project-overall.md",
      "biz-projects/templates/contract-eng-5-stages.md"
    ],
    "commits": [],
    "release_version": "v0.2.1"
  },
  "links": {
    "related_decisions": ["DEC-2026-0001"],
    "discussion": "Ask mode 平等讨论, Sponsor 推动 14 块调整",
    "followup": "应用 14 块调整到 m0.2/m1.3/m1.4/m1.5/m2.3/m2.5/m2.6"
  }
}
